{
  "id": "01K6A9Z8Y7X6W5V4T3S2R1Q0PN",
  "repositoryId": "01K6B2Z0R3P0S1T2V3W4X5Y6Z7",
  "repositoryName": "acme/billing",
  "title": "release-2.4 @ 5e6f7a8b9c0d",
  "ref": "release-2.4",
  "commitSha": "5e6f7a8b9c0d1e2f3a4b5c6d7e8f9a0b1c2d3e4f",
  "state": "closed",
  "startedBy": {
    "kind": "user",
    "userId": "01K6AZZ9Y8X7W6V5T4S3R2Q1P0",
    "agentName": null,
    "name": "janklan",
    "avatarUrl": "https://avatars.githubusercontent.com/u/1?v=4"
  },
  "createdAt": "2026-09-20T09:00:00Z",
  "closedAt": "2026-09-28T16:30:00Z",
  "closedBy": {
    "kind": "user",
    "userId": "01K6AZZ9Y8X7W6V5T4S3R2Q1P0",
    "agentName": null,
    "name": "janklan",
    "avatarUrl": "https://avatars.githubusercontent.com/u/1?v=4"
  },
  "closeNote": "Shipped in 2.4",
  "index": {
    "state": "ready",
    "filesTotal": 1240,
    "filesDone": 1240,
    "symbolsTotal": 3312,
    "startedAt": "2026-09-20T09:00:02Z",
    "finishedAt": "2026-09-20T09:01:10Z",
    "error": null
  },
  "counts": {
    "total": 5,
    "byStatus": {
      "open": 0,
      "in_progress": 0,
      "ready_for_review": 0,
      "verified": 4,
      "reopened": 0,
      "wont_do": 1
    },
    "byAwaiting": {
      "agent": 0,
      "user": 0,
      "none": 5
    },
    "outdated": 2
  },
  "lastEventSeq": 1795
}
