{
  "id": "01K6B3A1B2C3D4E5F6G7H8J9KM",
  "repositoryId": "01K6B2Z0R3P0S1T2V3W4X5Y6Z7",
  "repositoryName": "acme/billing",
  "title": "main @ 79f8595a4c1e",
  "ref": "main",
  "commitSha": "79f8595a4c1e2b3d5f6071829a3b4c5d6e7f8091",
  "state": "open",
  "startedBy": {
    "kind": "user",
    "userId": "01K6AZZ9Y8X7W6V5T4S3R2Q1P0",
    "agentName": null,
    "name": "janklan",
    "avatarUrl": "https://avatars.githubusercontent.com/u/1?v=4"
  },
  "createdAt": "2026-09-29T07:05:00Z",
  "closedAt": null,
  "closedBy": null,
  "closeNote": null,
  "index": {
    "state": "pending",
    "filesTotal": null,
    "filesDone": 0,
    "symbolsTotal": 0,
    "startedAt": null,
    "finishedAt": null,
    "error": null
  },
  "counts": {
    "total": 0,
    "byStatus": {
      "open": 0,
      "in_progress": 0,
      "ready_for_review": 0,
      "verified": 0,
      "reopened": 0,
      "wont_do": 0
    },
    "byAwaiting": {
      "agent": 0,
      "user": 0,
      "none": 0
    },
    "outdated": 0
  },
  "lastEventSeq": 1801
}
